{
  "schemaVersion": "match-rule/v1",
  "ruleKey": {
    "namespace": "default",
    "ruleId": 1
  },
  "contract": {
    "schemaVersion": "logical-node-contract/v3",
    "attributes": [],
    "facts": [],
    "indexes": []
  },
  "prefilter": {
    "schemaVersion": "prefilter/v3",
    "bitmap": {
      "resultType": "bitmap",
      "expr": {
        "op": "none"
      }
    }
  },
  "evaluation": {
    "schemaVersion": "evaluation/v3",
    "canJoin": {
      "schemaVersion": "expression-scalar/v3",
      "resultType": "bool",
      "expr": {
        "op": "bool_literal",
        "value": false
      }
    },
    "canComplete": {
      "schemaVersion": "expression-scalar/v3",
      "resultType": "bool",
      "expr": {
        "op": "bool_literal",
        "value": false
      }
    }
  },
  "scoring": {
    "type": "constant",
    "params": {
      "value": 0
    }
  },
  "seedSelection": {
    "type": "arrival",
    "params": {}
  },
  "runtime": {
    "candidateLimitPerSeed": 128,
    "maxPlayers": 8,
    "attemptLimitPerProduceMatch": 500,
    "attemptLimitPerMatchRound": 500
  }
}
